{
  "$schema": "https://json-schema.org/draft/2020-12/schema",
  "$id": "event-audit-billing-contract-v1.schema.json",
  "type": "object",
  "additionalProperties": false,
  "required": [
    "$schema",
    "contract_id",
    "version",
    "generated_at",
    "binding_goal",
    "status",
    "event",
    "outbox",
    "inbox",
    "audit",
    "effect_receipt",
    "billing",
    "invariants"
  ],
  "properties": {
    "$schema": {
      "type": "string"
    },
    "contract_id": {
      "type": "string",
      "minLength": 1
    },
    "version": {
      "type": "string",
      "pattern": "^1\\.0\\.0$"
    },
    "generated_at": {
      "type": "string",
      "pattern": "^\\d{4}-\\d{2}-\\d{2}T"
    },
    "binding_goal": {
      "type": "object",
      "additionalProperties": false,
      "required": [
        "path",
        "sha256"
      ],
      "properties": {
        "path": {
          "type": "string",
          "const": "goals/goal-02-platform-foundation-security-observability.md"
        },
        "sha256": {
          "type": "string",
          "const": "742e194e6b2d3e2b6fe9390bbabe96a6bbe0f40bdf99d8ed4ae4060a711a87f9"
        }
      }
    },
    "status": {
      "type": "object",
      "additionalProperties": false,
      "required": [
        "contract",
        "runtime",
        "production_eligible"
      ],
      "properties": {
        "contract": {
          "type": "string",
          "enum": [
            "target_contract",
            "verified_contract"
          ]
        },
        "runtime": {
          "type": "string",
          "enum": [
            "not_run",
            "verified_local",
            "verified_controlled",
            "failed"
          ]
        },
        "production_eligible": {
          "type": "boolean",
          "const": false
        }
      }
    },
    "event": {
      "type": "object",
      "additionalProperties": false,
      "required": [
        "authority",
        "write_version",
        "read_versions",
        "max_payload_bytes",
        "envelope_fields",
        "compatibility",
        "unknown_minor",
        "unknown_major",
        "ordering"
      ],
      "properties": {
        "authority": {
          "type": "string"
        },
        "write_version": {
          "type": "integer",
          "const": 2
        },
        "read_versions": {
          "type": "array",
          "prefixItems": [
            {
              "type": "integer",
              "const": 2
            },
            {
              "type": "integer",
              "const": 1
            }
          ],
          "minItems": 2,
          "maxItems": 2
        },
        "max_payload_bytes": {
          "type": "integer",
          "maximum": 65536
        },
        "envelope_fields": {
          "type": "array",
          "items": {
            "type": "string"
          },
          "minItems": 1,
          "uniqueItems": true
        },
        "compatibility": {
          "type": "string"
        },
        "unknown_minor": {
          "type": "string"
        },
        "unknown_major": {
          "type": "string",
          "const": "quarantine_fail_closed"
        },
        "ordering": {
          "type": "string"
        }
      },
      "const": {
        "authority": "Converact Platform Event Contract",
        "write_version": 2,
        "read_versions": [
          2,
          1
        ],
        "max_payload_bytes": 65536,
        "envelope_fields": [
          "schema_version",
          "event_id",
          "event_type",
          "tenant_id",
          "producer_identity",
          "authority",
          "aggregate_type",
          "aggregate_id",
          "aggregate_revision",
          "ordering_key",
          "idempotency_key",
          "payload_digest",
          "occurred_at",
          "observed_at",
          "correlation",
          "causation_event_id",
          "purpose",
          "region_policy",
          "retention_policy",
          "data"
        ],
        "compatibility": "N_and_N_minus_1_readers_additive_minor_only",
        "unknown_minor": "preserve_and_ignore_only_if_no_effect_semantics",
        "unknown_major": "quarantine_fail_closed",
        "ordering": "per_tenant_authority_aggregate_or_declared_ordering_key"
      }
    },
    "outbox": {
      "type": "object",
      "additionalProperties": false,
      "required": [
        "transaction",
        "claim",
        "delivery",
        "retry",
        "media_hot_path"
      ],
      "properties": {
        "transaction": {
          "type": "string"
        },
        "claim": {
          "type": "string"
        },
        "delivery": {
          "type": "string"
        },
        "retry": {
          "type": "string"
        },
        "media_hot_path": {
          "type": "string"
        }
      },
      "const": {
        "transaction": "same_domain_transaction_as_authoritative_state",
        "claim": "bounded_batch_lease_skip_locked",
        "delivery": "at_least_once",
        "retry": "bounded_with_dead_letter_and_query",
        "media_hot_path": "forbidden"
      }
    },
    "inbox": {
      "type": "object",
      "additionalProperties": false,
      "required": [
        "uniqueness",
        "same_id_same_digest",
        "same_id_different_digest",
        "stale_revision",
        "gap_or_unknown"
      ],
      "properties": {
        "uniqueness": {
          "type": "string"
        },
        "same_id_same_digest": {
          "type": "string"
        },
        "same_id_different_digest": {
          "type": "string",
          "const": "conflict"
        },
        "stale_revision": {
          "type": "string"
        },
        "gap_or_unknown": {
          "type": "string"
        }
      },
      "const": {
        "uniqueness": "tenant_consumer_event_id",
        "same_id_same_digest": "replay_noop",
        "same_id_different_digest": "conflict",
        "stale_revision": "ignore_with_receipt",
        "gap_or_unknown": "freeze_effect_then_query_reconcile"
      }
    },
    "audit": {
      "type": "object",
      "additionalProperties": false,
      "required": [
        "authority",
        "append_only",
        "integrity",
        "links",
        "correction"
      ],
      "properties": {
        "authority": {
          "type": "string"
        },
        "append_only": {
          "type": "boolean",
          "const": true
        },
        "integrity": {
          "type": "string"
        },
        "links": {
          "type": "array",
          "items": {
            "type": "string"
          },
          "minItems": 1,
          "uniqueItems": true
        },
        "correction": {
          "type": "string"
        }
      },
      "const": {
        "authority": "Converact Platform Audit",
        "append_only": true,
        "integrity": "per_tenant_hash_chain_plus_verification_receipt",
        "links": [
          "event_id",
          "effect_id",
          "receipt_id",
          "billing_key",
          "correlation_id"
        ],
        "correction": "append_reversal_or_tombstone_never_mutate_history"
      }
    },
    "effect_receipt": {
      "type": "object",
      "additionalProperties": false,
      "required": [
        "stages",
        "uniqueness",
        "monotonic_stage_progression",
        "same_key_same_digest",
        "same_key_different_digest",
        "unknown_effect",
        "stale_writer"
      ],
      "properties": {
        "stages": {
          "type": "array",
          "items": {
            "type": "string"
          },
          "minItems": 1,
          "uniqueItems": true
        },
        "uniqueness": {
          "type": "string"
        },
        "monotonic_stage_progression": {
          "type": "boolean",
          "const": true
        },
        "same_key_same_digest": {
          "type": "string"
        },
        "same_key_different_digest": {
          "type": "string"
        },
        "unknown_effect": {
          "type": "string",
          "const": "query_reconcile_no_blind_retry"
        },
        "stale_writer": {
          "type": "string"
        }
      },
      "const": {
        "stages": [
          "accepted",
          "completed",
          "state_observed"
        ],
        "uniqueness": "tenant_effect_stage_generation",
        "monotonic_stage_progression": true,
        "same_key_same_digest": "replay_noop",
        "same_key_different_digest": "conflict",
        "unknown_effect": "query_reconcile_no_blind_retry",
        "stale_writer": "reject_by_owner_epoch_and_generation"
      }
    },
    "billing": {
      "type": "object",
      "additionalProperties": false,
      "required": [
        "authority",
        "writer_policy",
        "ledger",
        "sources",
        "duplicate_same_digest",
        "duplicate_different_digest_or_writer",
        "reconstruction"
      ],
      "properties": {
        "authority": {
          "type": "string"
        },
        "writer_policy": {
          "type": "string"
        },
        "ledger": {
          "type": "string"
        },
        "sources": {
          "type": "array",
          "items": {
            "type": "object",
            "additionalProperties": false,
            "required": [
              "source",
              "key_template",
              "writer"
            ],
            "properties": {
              "source": {
                "type": "string"
              },
              "key_template": {
                "type": "string"
              },
              "writer": {
                "type": "string"
              }
            }
          },
          "minItems": 4,
          "maxItems": 4
        },
        "duplicate_same_digest": {
          "type": "string"
        },
        "duplicate_different_digest_or_writer": {
          "type": "string"
        },
        "reconstruction": {
          "type": "string"
        }
      },
      "const": {
        "authority": "Converact Metering Billing",
        "writer_policy": "one_writer_identity_and_epoch_per_billing_key",
        "ledger": "append_only_immutable_usage_and_reversal_entries",
        "sources": [
          {
            "source": "directed_media_edge_generation",
            "key_template": "edge:{tenant}:{interaction}:{edge}:{generation}:{direction}",
            "writer": "media_receipt_projector"
          },
          {
            "source": "ai_run_generation",
            "key_template": "ai:{tenant}:{agent_run}:{generation}",
            "writer": "agent_runtime_usage_adapter"
          },
          {
            "source": "recording_segment",
            "key_template": "recording:{tenant}:{manifest}:{segment}:{owner_epoch}",
            "writer": "recording_receipt_projector"
          },
          {
            "source": "external_action_attempt",
            "key_template": "action:{tenant}:{intent}:{attempt_generation}",
            "writer": "engage_action_receipt_projector"
          }
        ],
        "duplicate_same_digest": "replay_no_charge",
        "duplicate_different_digest_or_writer": "conflict_freeze_rating",
        "reconstruction": "from_verified_receipts_and_immutable_usage_entries"
      }
    },
    "invariants": {
      "type": "array",
      "items": {
        "type": "string"
      },
      "minItems": 1,
      "uniqueItems": true,
      "const": [
        "event_bus_is_not_a_domain_or_media_authority",
        "network_delivery_is_not_exactly_once",
        "unknown_effect_is_never_blindly_retried",
        "one_billing_key_and_writer_per_generation",
        "ordinary_media_has_no_event_audit_or_billing_io_per_packet"
      ]
    }
  }
}
