{
  "$schema": "./event-audit-billing-contract-v1.schema.json",
  "contract_id": "converact-platform-event-audit-billing-v1",
  "version": "1.0.0",
  "generated_at": "2026-08-01T00:00:00Z",
  "binding_goal": {
    "path": "goals/goal-02-platform-foundation-security-observability.md",
    "sha256": "742e194e6b2d3e2b6fe9390bbabe96a6bbe0f40bdf99d8ed4ae4060a711a87f9"
  },
  "status": {
    "contract": "target_contract",
    "runtime": "not_run",
    "production_eligible": false
  },
  "event": {
    "authority": "Converact Platform Event Contract",
    "write_version": 2,
    "read_versions": [
      2,
      1
    ],
    "max_payload_bytes": 65536,
    "envelope_fields": [
      "schema_version",
      "event_id",
      "event_type",
      "tenant_id",
      "producer_identity",
      "authority",
      "aggregate_type",
      "aggregate_id",
      "aggregate_revision",
      "ordering_key",
      "idempotency_key",
      "payload_digest",
      "occurred_at",
      "observed_at",
      "correlation",
      "causation_event_id",
      "purpose",
      "region_policy",
      "retention_policy",
      "data"
    ],
    "compatibility": "N_and_N_minus_1_readers_additive_minor_only",
    "unknown_minor": "preserve_and_ignore_only_if_no_effect_semantics",
    "unknown_major": "quarantine_fail_closed",
    "ordering": "per_tenant_authority_aggregate_or_declared_ordering_key"
  },
  "outbox": {
    "transaction": "same_domain_transaction_as_authoritative_state",
    "claim": "bounded_batch_lease_skip_locked",
    "delivery": "at_least_once",
    "retry": "bounded_with_dead_letter_and_query",
    "media_hot_path": "forbidden"
  },
  "inbox": {
    "uniqueness": "tenant_consumer_event_id",
    "same_id_same_digest": "replay_noop",
    "same_id_different_digest": "conflict",
    "stale_revision": "ignore_with_receipt",
    "gap_or_unknown": "freeze_effect_then_query_reconcile"
  },
  "audit": {
    "authority": "Converact Platform Audit",
    "append_only": true,
    "integrity": "per_tenant_hash_chain_plus_verification_receipt",
    "links": [
      "event_id",
      "effect_id",
      "receipt_id",
      "billing_key",
      "correlation_id"
    ],
    "correction": "append_reversal_or_tombstone_never_mutate_history"
  },
  "effect_receipt": {
    "stages": [
      "accepted",
      "completed",
      "state_observed"
    ],
    "uniqueness": "tenant_effect_stage_generation",
    "monotonic_stage_progression": true,
    "same_key_same_digest": "replay_noop",
    "same_key_different_digest": "conflict",
    "unknown_effect": "query_reconcile_no_blind_retry",
    "stale_writer": "reject_by_owner_epoch_and_generation"
  },
  "billing": {
    "authority": "Converact Metering Billing",
    "writer_policy": "one_writer_identity_and_epoch_per_billing_key",
    "ledger": "append_only_immutable_usage_and_reversal_entries",
    "sources": [
      {
        "source": "directed_media_edge_generation",
        "key_template": "edge:{tenant}:{interaction}:{edge}:{generation}:{direction}",
        "writer": "media_receipt_projector"
      },
      {
        "source": "ai_run_generation",
        "key_template": "ai:{tenant}:{agent_run}:{generation}",
        "writer": "agent_runtime_usage_adapter"
      },
      {
        "source": "recording_segment",
        "key_template": "recording:{tenant}:{manifest}:{segment}:{owner_epoch}",
        "writer": "recording_receipt_projector"
      },
      {
        "source": "external_action_attempt",
        "key_template": "action:{tenant}:{intent}:{attempt_generation}",
        "writer": "engage_action_receipt_projector"
      }
    ],
    "duplicate_same_digest": "replay_no_charge",
    "duplicate_different_digest_or_writer": "conflict_freeze_rating",
    "reconstruction": "from_verified_receipts_and_immutable_usage_entries"
  },
  "invariants": [
    "event_bus_is_not_a_domain_or_media_authority",
    "network_delivery_is_not_exactly_once",
    "unknown_effect_is_never_blindly_retried",
    "one_billing_key_and_writer_per_generation",
    "ordinary_media_has_no_event_audit_or_billing_io_per_packet"
  ]
}
